{
  "$schema": "https://json-schema.org/draft/2020-12/schema",
  "type": "object",
  "additionalProperties": false,
  "required": [
    "schema",
    "status",
    "s0_steps",
    "workers",
    "supervisor_steps",
    "notes"
  ],
  "properties": {
    "schema": {
      "const": "job-awareness-step-io-v1"
    },
    "status": {
      "const": "PLAN_ONLY"
    },
    "s0_steps": {
      "type": "array",
      "minItems": 6,
      "maxItems": 6,
      "items": {
        "type": "object",
        "additionalProperties": false,
        "required": [
          "id",
          "owner",
          "inputs",
          "outputs",
          "depends_on"
        ],
        "properties": {
          "id": {
            "type": "string",
            "minLength": 1
          },
          "owner": {
            "enum": [
              "S0",
              "W1",
              "W2",
              "W3",
              "W4",
              "W5",
              "SUPERVISOR"
            ]
          },
          "inputs": {
            "type": "array",
            "minItems": 1,
            "items": {
              "type": "object",
              "additionalProperties": false,
              "required": [
                "ref",
                "format"
              ],
              "properties": {
                "ref": {
                  "type": "string",
                  "minLength": 1
                },
                "format": {
                  "enum": [
                    "reference",
                    "json",
                    "jsonl",
                    "csv",
                    "md",
                    "external"
                  ]
                }
              }
            }
          },
          "outputs": {
            "type": "array",
            "minItems": 1,
            "items": {
              "type": "object",
              "additionalProperties": false,
              "required": [
                "ref",
                "format"
              ],
              "properties": {
                "ref": {
                  "type": "string",
                  "minLength": 1
                },
                "format": {
                  "enum": [
                    "reference",
                    "json",
                    "jsonl",
                    "csv",
                    "md",
                    "external"
                  ]
                }
              }
            }
          },
          "depends_on": {
            "type": "array",
            "items": {
              "type": "string",
              "minLength": 1
            }
          }
        }
      }
    },
    "workers": {
      "type": "object",
      "additionalProperties": false,
      "required": [
        "W1",
        "W2",
        "W3",
        "W4",
        "W5"
      ],
      "properties": {
        "W1": {
          "type": "array",
          "minItems": 1,
          "items": {
            "type": "object",
            "additionalProperties": false,
            "required": [
              "id",
              "owner",
              "inputs",
              "outputs",
              "depends_on"
            ],
            "properties": {
              "id": {
                "type": "string",
                "minLength": 1
              },
              "owner": {
                "enum": [
                  "S0",
                  "W1",
                  "W2",
                  "W3",
                  "W4",
                  "W5",
                  "SUPERVISOR"
                ]
              },
              "inputs": {
                "type": "array",
                "minItems": 1,
                "items": {
                  "type": "object",
                  "additionalProperties": false,
                  "required": [
                    "ref",
                    "format"
                  ],
                  "properties": {
                    "ref": {
                      "type": "string",
                      "minLength": 1
                    },
                    "format": {
                      "enum": [
                        "reference",
                        "json",
                        "jsonl",
                        "csv",
                        "md",
                        "external"
                      ]
                    }
                  }
                }
              },
              "outputs": {
                "type": "array",
                "minItems": 1,
                "items": {
                  "type": "object",
                  "additionalProperties": false,
                  "required": [
                    "ref",
                    "format"
                  ],
                  "properties": {
                    "ref": {
                      "type": "string",
                      "minLength": 1
                    },
                    "format": {
                      "enum": [
                        "reference",
                        "json",
                        "jsonl",
                        "csv",
                        "md",
                        "external"
                      ]
                    }
                  }
                }
              },
              "depends_on": {
                "type": "array",
                "items": {
                  "type": "string",
                  "minLength": 1
                }
              }
            }
          }
        },
        "W2": {
          "type": "array",
          "minItems": 1,
          "items": {
            "type": "object",
            "additionalProperties": false,
            "required": [
              "id",
              "owner",
              "inputs",
              "outputs",
              "depends_on"
            ],
            "properties": {
              "id": {
                "type": "string",
                "minLength": 1
              },
              "owner": {
                "enum": [
                  "S0",
                  "W1",
                  "W2",
                  "W3",
                  "W4",
                  "W5",
                  "SUPERVISOR"
                ]
              },
              "inputs": {
                "type": "array",
                "minItems": 1,
                "items": {
                  "type": "object",
                  "additionalProperties": false,
                  "required": [
                    "ref",
                    "format"
                  ],
                  "properties": {
                    "ref": {
                      "type": "string",
                      "minLength": 1
                    },
                    "format": {
                      "enum": [
                        "reference",
                        "json",
                        "jsonl",
                        "csv",
                        "md",
                        "external"
                      ]
                    }
                  }
                }
              },
              "outputs": {
                "type": "array",
                "minItems": 1,
                "items": {
                  "type": "object",
                  "additionalProperties": false,
                  "required": [
                    "ref",
                    "format"
                  ],
                  "properties": {
                    "ref": {
                      "type": "string",
                      "minLength": 1
                    },
                    "format": {
                      "enum": [
                        "reference",
                        "json",
                        "jsonl",
                        "csv",
                        "md",
                        "external"
                      ]
                    }
                  }
                }
              },
              "depends_on": {
                "type": "array",
                "items": {
                  "type": "string",
                  "minLength": 1
                }
              }
            }
          }
        },
        "W3": {
          "type": "array",
          "minItems": 1,
          "items": {
            "type": "object",
            "additionalProperties": false,
            "required": [
              "id",
              "owner",
              "inputs",
              "outputs",
              "depends_on"
            ],
            "properties": {
              "id": {
                "type": "string",
                "minLength": 1
              },
              "owner": {
                "enum": [
                  "S0",
                  "W1",
                  "W2",
                  "W3",
                  "W4",
                  "W5",
                  "SUPERVISOR"
                ]
              },
              "inputs": {
                "type": "array",
                "minItems": 1,
                "items": {
                  "type": "object",
                  "additionalProperties": false,
                  "required": [
                    "ref",
                    "format"
                  ],
                  "properties": {
                    "ref": {
                      "type": "string",
                      "minLength": 1
                    },
                    "format": {
                      "enum": [
                        "reference",
                        "json",
                        "jsonl",
                        "csv",
                        "md",
                        "external"
                      ]
                    }
                  }
                }
              },
              "outputs": {
                "type": "array",
                "minItems": 1,
                "items": {
                  "type": "object",
                  "additionalProperties": false,
                  "required": [
                    "ref",
                    "format"
                  ],
                  "properties": {
                    "ref": {
                      "type": "string",
                      "minLength": 1
                    },
                    "format": {
                      "enum": [
                        "reference",
                        "json",
                        "jsonl",
                        "csv",
                        "md",
                        "external"
                      ]
                    }
                  }
                }
              },
              "depends_on": {
                "type": "array",
                "items": {
                  "type": "string",
                  "minLength": 1
                }
              }
            }
          }
        },
        "W4": {
          "type": "array",
          "minItems": 1,
          "items": {
            "type": "object",
            "additionalProperties": false,
            "required": [
              "id",
              "owner",
              "inputs",
              "outputs",
              "depends_on"
            ],
            "properties": {
              "id": {
                "type": "string",
                "minLength": 1
              },
              "owner": {
                "enum": [
                  "S0",
                  "W1",
                  "W2",
                  "W3",
                  "W4",
                  "W5",
                  "SUPERVISOR"
                ]
              },
              "inputs": {
                "type": "array",
                "minItems": 1,
                "items": {
                  "type": "object",
                  "additionalProperties": false,
                  "required": [
                    "ref",
                    "format"
                  ],
                  "properties": {
                    "ref": {
                      "type": "string",
                      "minLength": 1
                    },
                    "format": {
                      "enum": [
                        "reference",
                        "json",
                        "jsonl",
                        "csv",
                        "md",
                        "external"
                      ]
                    }
                  }
                }
              },
              "outputs": {
                "type": "array",
                "minItems": 1,
                "items": {
                  "type": "object",
                  "additionalProperties": false,
                  "required": [
                    "ref",
                    "format"
                  ],
                  "properties": {
                    "ref": {
                      "type": "string",
                      "minLength": 1
                    },
                    "format": {
                      "enum": [
                        "reference",
                        "json",
                        "jsonl",
                        "csv",
                        "md",
                        "external"
                      ]
                    }
                  }
                }
              },
              "depends_on": {
                "type": "array",
                "items": {
                  "type": "string",
                  "minLength": 1
                }
              }
            }
          }
        },
        "W5": {
          "type": "array",
          "minItems": 1,
          "items": {
            "type": "object",
            "additionalProperties": false,
            "required": [
              "id",
              "owner",
              "inputs",
              "outputs",
              "depends_on"
            ],
            "properties": {
              "id": {
                "type": "string",
                "minLength": 1
              },
              "owner": {
                "enum": [
                  "S0",
                  "W1",
                  "W2",
                  "W3",
                  "W4",
                  "W5",
                  "SUPERVISOR"
                ]
              },
              "inputs": {
                "type": "array",
                "minItems": 1,
                "items": {
                  "type": "object",
                  "additionalProperties": false,
                  "required": [
                    "ref",
                    "format"
                  ],
                  "properties": {
                    "ref": {
                      "type": "string",
                      "minLength": 1
                    },
                    "format": {
                      "enum": [
                        "reference",
                        "json",
                        "jsonl",
                        "csv",
                        "md",
                        "external"
                      ]
                    }
                  }
                }
              },
              "outputs": {
                "type": "array",
                "minItems": 1,
                "items": {
                  "type": "object",
                  "additionalProperties": false,
                  "required": [
                    "ref",
                    "format"
                  ],
                  "properties": {
                    "ref": {
                      "type": "string",
                      "minLength": 1
                    },
                    "format": {
                      "enum": [
                        "reference",
                        "json",
                        "jsonl",
                        "csv",
                        "md",
                        "external"
                      ]
                    }
                  }
                }
              },
              "depends_on": {
                "type": "array",
                "items": {
                  "type": "string",
                  "minLength": 1
                }
              }
            }
          }
        }
      }
    },
    "supervisor_steps": {
      "type": "array",
      "minItems": 5,
      "maxItems": 5,
      "items": {
        "type": "object",
        "additionalProperties": false,
        "required": [
          "id",
          "owner",
          "inputs",
          "outputs",
          "depends_on"
        ],
        "properties": {
          "id": {
            "type": "string",
            "minLength": 1
          },
          "owner": {
            "enum": [
              "S0",
              "W1",
              "W2",
              "W3",
              "W4",
              "W5",
              "SUPERVISOR"
            ]
          },
          "inputs": {
            "type": "array",
            "minItems": 1,
            "items": {
              "type": "object",
              "additionalProperties": false,
              "required": [
                "ref",
                "format"
              ],
              "properties": {
                "ref": {
                  "type": "string",
                  "minLength": 1
                },
                "format": {
                  "enum": [
                    "reference",
                    "json",
                    "jsonl",
                    "csv",
                    "md",
                    "external"
                  ]
                }
              }
            }
          },
          "outputs": {
            "type": "array",
            "minItems": 1,
            "items": {
              "type": "object",
              "additionalProperties": false,
              "required": [
                "ref",
                "format"
              ],
              "properties": {
                "ref": {
                  "type": "string",
                  "minLength": 1
                },
                "format": {
                  "enum": [
                    "reference",
                    "json",
                    "jsonl",
                    "csv",
                    "md",
                    "external"
                  ]
                }
              }
            }
          },
          "depends_on": {
            "type": "array",
            "items": {
              "type": "string",
              "minLength": 1
            }
          }
        }
      }
    },
    "notes": {
      "type": "array",
      "items": {
        "type": "string"
      }
    }
  }
}
