{
  "schema": "job-awareness-step-io-v1",
  "status": "PLAN_ONLY",
  "s0_steps": [
    {
      "id": "S0.0",
      "owner": "S0",
      "inputs": [
        {
          "ref": "repo://AGENTS.md",
          "format": "reference"
        },
        {
          "ref": "repo://DEVELOPMENT.md",
          "format": "reference"
        },
        {
          "ref": "plan://worker-manifest.json",
          "format": "reference"
        }
      ],
      "outputs": [
        {
          "ref": "S0/preflight.json",
          "format": "json"
        },
        {
          "ref": "S0/provenance.json",
          "format": "json"
        },
        {
          "ref": "S0/events.jsonl",
          "format": "jsonl"
        }
      ],
      "depends_on": []
    },
    {
      "id": "S0.1",
      "owner": "S0",
      "inputs": [
        {
          "ref": "S0/provenance.json",
          "format": "json"
        },
        {
          "ref": "plan://FIXTURE-CONTRACT.md",
          "format": "reference"
        }
      ],
      "outputs": [
        {
          "ref": "run-manifest.json",
          "format": "json"
        },
        {
          "ref": "S0/events.jsonl",
          "format": "jsonl"
        }
      ],
      "depends_on": [
        "S0.0"
      ]
    },
    {
      "id": "S0.2",
      "owner": "S0",
      "inputs": [
        {
          "ref": "run-manifest.json",
          "format": "json"
        },
        {
          "ref": "plan://FIXTURE-CONTRACT.md",
          "format": "reference"
        }
      ],
      "outputs": [
        {
          "ref": "fixtures/fixture-manifest.json",
          "format": "json"
        },
        {
          "ref": "S0/fixture-index.json",
          "format": "json"
        },
        {
          "ref": "S0/events.jsonl",
          "format": "jsonl"
        }
      ],
      "depends_on": [
        "S0.1"
      ]
    },
    {
      "id": "S0.3",
      "owner": "S0",
      "inputs": [
        {
          "ref": "fixtures/fixture-manifest.json",
          "format": "json"
        },
        {
          "ref": "plan://DESKTOP-OPERATOR.md",
          "format": "reference"
        }
      ],
      "outputs": [
        {
          "ref": "S0/resource-ledger.json",
          "format": "json"
        },
        {
          "ref": "S0/connection-evidence.json",
          "format": "json"
        },
        {
          "ref": "S0/preflight.json",
          "format": "json"
        }
      ],
      "depends_on": [
        "S0.2"
      ]
    },
    {
      "id": "S0.4",
      "owner": "S0",
      "inputs": [
        {
          "ref": "fixtures/fixture-manifest.json",
          "format": "json"
        },
        {
          "ref": "plan://worker-manifest.json",
          "format": "reference"
        },
        {
          "ref": "S0/preflight.json",
          "format": "json"
        }
      ],
      "outputs": [
        {
          "ref": "inputs/W1.input.json",
          "format": "json"
        },
        {
          "ref": "inputs/W2.input.json",
          "format": "json"
        },
        {
          "ref": "inputs/W3.input.json",
          "format": "json"
        },
        {
          "ref": "inputs/W4.input.json",
          "format": "json"
        },
        {
          "ref": "inputs/W5.input.json",
          "format": "json"
        },
        {
          "ref": "run-manifest.json",
          "format": "json"
        }
      ],
      "depends_on": [
        "S0.3"
      ]
    },
    {
      "id": "S0.5",
      "owner": "S0",
      "inputs": [
        {
          "ref": "run-manifest.json",
          "format": "json"
        },
        {
          "ref": "S0/preflight.json",
          "format": "json"
        },
        {
          "ref": "inputs/W1.input.json",
          "format": "json"
        },
        {
          "ref": "inputs/W2.input.json",
          "format": "json"
        },
        {
          "ref": "inputs/W3.input.json",
          "format": "json"
        },
        {
          "ref": "inputs/W4.input.json",
          "format": "json"
        },
        {
          "ref": "inputs/W5.input.json",
          "format": "json"
        }
      ],
      "outputs": [
        {
          "ref": "S0/readiness.md",
          "format": "md"
        },
        {
          "ref": "S0/preflight.json",
          "format": "json"
        }
      ],
      "depends_on": [
        "S0.4"
      ]
    }
  ],
  "workers": {
    "W1": [
      {
        "id": "RAW-BASE",
        "owner": "W1",
        "inputs": [
          {
            "ref": "inputs/W1.input.json",
            "format": "json"
          },
          {
            "ref": "fixtures/fixture-manifest.json",
            "format": "json"
          }
        ],
        "outputs": [
          {
            "ref": "W1/wire/RAW-BASE.json",
            "format": "json"
          },
          {
            "ref": "W1/carrier-matrix.csv",
            "format": "csv"
          },
          {
            "ref": "W1/results.json",
            "format": "json"
          },
          {
            "ref": "W1/events.jsonl",
            "format": "jsonl"
          }
        ],
        "depends_on": [
          "S0.5"
        ]
      },
      {
        "id": "M-META",
        "owner": "W1",
        "inputs": [
          {
            "ref": "inputs/W1.input.json",
            "format": "json"
          },
          {
            "ref": "fixtures/fixture-manifest.json",
            "format": "json"
          }
        ],
        "outputs": [
          {
            "ref": "W1/wire/M-META.json",
            "format": "json"
          },
          {
            "ref": "W1/carrier-matrix.csv",
            "format": "csv"
          },
          {
            "ref": "W1/results.json",
            "format": "json"
          },
          {
            "ref": "W1/events.jsonl",
            "format": "jsonl"
          }
        ],
        "depends_on": [
          "S0.5"
        ]
      },
      {
        "id": "M-TEXT",
        "owner": "W1",
        "inputs": [
          {
            "ref": "inputs/W1.input.json",
            "format": "json"
          },
          {
            "ref": "fixtures/fixture-manifest.json",
            "format": "json"
          }
        ],
        "outputs": [
          {
            "ref": "W1/wire/M-TEXT.json",
            "format": "json"
          },
          {
            "ref": "W1/carrier-matrix.csv",
            "format": "csv"
          },
          {
            "ref": "W1/results.json",
            "format": "json"
          },
          {
            "ref": "W1/events.jsonl",
            "format": "jsonl"
          }
        ],
        "depends_on": [
          "S0.5"
        ]
      },
      {
        "id": "M-STRUCT",
        "owner": "W1",
        "inputs": [
          {
            "ref": "inputs/W1.input.json",
            "format": "json"
          },
          {
            "ref": "fixtures/fixture-manifest.json",
            "format": "json"
          }
        ],
        "outputs": [
          {
            "ref": "W1/wire/M-STRUCT.json",
            "format": "json"
          },
          {
            "ref": "W1/carrier-matrix.csv",
            "format": "csv"
          },
          {
            "ref": "W1/results.json",
            "format": "json"
          },
          {
            "ref": "W1/events.jsonl",
            "format": "jsonl"
          }
        ],
        "depends_on": [
          "S0.5"
        ]
      },
      {
        "id": "M-ERROR",
        "owner": "W1",
        "inputs": [
          {
            "ref": "inputs/W1.input.json",
            "format": "json"
          },
          {
            "ref": "fixtures/fixture-manifest.json",
            "format": "json"
          }
        ],
        "outputs": [
          {
            "ref": "W1/wire/M-ERROR.json",
            "format": "json"
          },
          {
            "ref": "W1/carrier-matrix.csv",
            "format": "csv"
          },
          {
            "ref": "W1/results.json",
            "format": "json"
          },
          {
            "ref": "W1/events.jsonl",
            "format": "jsonl"
          }
        ],
        "depends_on": [
          "S0.5"
        ]
      },
      {
        "id": "M-SURFACES",
        "owner": "W1",
        "inputs": [
          {
            "ref": "inputs/W1.input.json",
            "format": "json"
          },
          {
            "ref": "fixtures/fixture-manifest.json",
            "format": "json"
          }
        ],
        "outputs": [
          {
            "ref": "W1/wire/M-SURFACES.json",
            "format": "json"
          },
          {
            "ref": "W1/carrier-matrix.csv",
            "format": "csv"
          },
          {
            "ref": "W1/results.json",
            "format": "json"
          },
          {
            "ref": "W1/events.jsonl",
            "format": "jsonl"
          }
        ],
        "depends_on": [
          "S0.5"
        ]
      },
      {
        "id": "M-RELOAD",
        "owner": "W1",
        "inputs": [
          {
            "ref": "inputs/W1.input.json",
            "format": "json"
          },
          {
            "ref": "fixtures/fixture-manifest.json",
            "format": "json"
          }
        ],
        "outputs": [
          {
            "ref": "W1/wire/M-RELOAD.json",
            "format": "json"
          },
          {
            "ref": "W1/results.json",
            "format": "json"
          },
          {
            "ref": "W1/events.jsonl",
            "format": "jsonl"
          }
        ],
        "depends_on": [
          "S0.5"
        ]
      },
      {
        "id": "M-COMPAT",
        "owner": "W1",
        "inputs": [
          {
            "ref": "inputs/W1.input.json",
            "format": "json"
          },
          {
            "ref": "fixtures/fixture-manifest.json",
            "format": "json"
          }
        ],
        "outputs": [
          {